tmdbId,title,overview,tagline,genres,runtime,release_date,language,vote_average,vote_count,popularity,cast,crew,keywords,reviews
11839.0,The Court Jester,A hapless carnival performer masquerades as the court jester as part of a plot against a usurper who has overthrown the rightful king of England.,"We asked Shakespeare and Francis Bacon would they declare which one wrote this and they both said, “Get outta here!”","Music, Adventure, Comedy",101.0,1955-12-24,en,7.252,202.0,0.835,"Danny Kaye, Glynis Johns, Basil Rathbone, Angela Lansbury, Cecil Parker","Norman Panama, Melvin Frank","witch, england, sword, hypnosis, fool","Discretion is for fools and simpletons.

From the opening credits as Danny Kaye sings dressed as a harlequin jester you get the impression that this film will be a joyous romp, and so it is. Perhaps the most talked about film in Kaye's CV (even though it lost close to two million dollars on release), The Court Jester is a perfect vehicle for his blend of madcap showboating and serene warbling. Here he gets to play both the coward and the hero in a delightful dual role that is as energetic as it is mirthful - and thankfully  the supporting cast (Cecil Parker, Angela Lansbury and Basil Rathbone in particular) are clued into the nature of the film to bring about top entertaining results. Though to be fair, it would be ignorant of me to not point out that Glynis Johns' Maid Jean is under formed.

A number of hilarious sequences stand out in the film, from Hubert Hawkins transformation back and forth as Giacomo, to a brilliantly funny knighting ceremony, the film ticks all the boxes for fun family entertainment. Whilst do I need to mention ""the vessel with the pestle, the flagon with the dragon, and the chalice with the palace"" section of film that rightly stands the time for classic status. Great songs, great routines, Kaye on form, with Rathbone as the hissable villain, what more do you need? The Court Jester, a perfect movie for all the family. 8/10 || Really entertaining and all around fun musical parody featuring a charismatic performance from David Kaye and also has Basil Rathbone serviceable as the villain. Also nice having Glynis Johns and Angela Lansbury in there, Johns particularly stunning. **3.75/5** || Oh, this is a gem of celluloid that just keeps giving joy.  An adventure, comedy, romance, musical made for the whole family.

A movie written specifically for one actor (who then agrees to play the central part) doesnt happen often, let alone have that role portrayed with perfection....But Danny Kaye is that special kind of actor.  

A spoof of The Adventures Of Robin Hood that even managed to get its villain, the great Basil Rathbone (and its light-years ahead of Men In Tights).  This is an underrated masterpiece that I watch, laugh at and notice new things regularly.  It is one of those movies that can always lift your mood (or at the very least make you smile).  

The plot starts slowly and simply, becomes intricate, and weaves its medieval tapestry-like threads into a beautiful, neat picture at the end,  tying everything up (as all good musicals should). 

The dialogue is at a level that we miss in modern film.  And the timing of the lines is perfect from the classic chalice from the palace to the: 
“I’d like to get in, get on with it, get it over with, and get out. Get it?
“Got it.”
“Good.”
This film is endlessly quotable (in fact, the quotes page on IMDB is lengthy). 

Perfectly cast, Kaye is supported by Johns and Landsbury who glide across their scenes with grace and beauty, and Rathbone sneers and schemes his way through his limited screen time.

The swordplay in the final fight is glorious - up there with the best (the Princess Bride) in terms of skill and creativity. 

And the small gestures that the actors make through the movie, be they nudges, winks, kicks....the detail and timing here is outstanding and worthy of the greatest comedians in the business. 

What else - the costumes (perfectly completed by Edith Head) and sets are gorgeous. The colouring is stunning in a way that only a few films are.  And the music will keep you humming (and whistling) for ages after.  Hell, they even tried to make the credits interesting as Danny sings about the different roles involved in the making of the movie.  

My issues (and why its not 5 stars) - the pacing (it starts out very slow), the effects (rope swings, etc) and the ""march"" feel dated.  

But, I fell in love with this movie as a child (when my Mother introduced me to it).  It became a regular watch on video.  For me this has just gotten better as I get older, and like any long term loves, the issues fall aside.  One of my top 10 favourites of all time."
916.0,Bullitt,"Senator Walter Chalmers is aiming to take down mob boss Pete Ross with the help of testimony from the criminal's hothead brother Johnny, who is in protective custody in San Francisco under the watch of police lieutenant Frank Bullitt. When a pair of mob hitmen enter the scene, Bullitt follows their trail through a maze of complications and double-crosses. This thriller includes one of the most famous car chases ever filmed.","The word ""cop"" isn't written all over him—something more puzzling is.","Action, Crime, Thriller, Romance, Drama",113.0,1968-10-17,en,7.153,1200.0,3.2607,"Steve McQueen, Robert Vaughn, Jacqueline Bisset, Don Gordon, Robert Duvall",Peter Yates,"hotel, airport, based on novel or book, police, chase, san francisco, california, detective, witness protection, politician, principal witness , organized crime, burglary, hospital, gunfight, explosion, blunt, stolen identity, coroner, mob hit, mysterious, ford mustang, dodge charger, suspenseful, intense, bold, defiant","Steve McQueen is at his most grumpily enigmatic as he portrays this unorthodox San Francisco police lieutenant. He's none too pleased when the greasy-pole merchant ""Sen. Chambers"" (Robert Vaughn) has him detailed to guard a shady character who's a potential witness in a case against some hitherto Teflon gangsters. When two gunmen break into his room and gun him down, it becomes imperative that ""Bullitt"" gets to the bottom of things before his new found pal nails his slats to the mast. With the active support of ""Capt. Bennet"" (Simon Oakland) who increasingly has to run point for the man, he begins an investigation that manages to irritate just about everyone as he realises the case is complex and downright dangerous. It's this left field style of work that this cop excels at, and McQueen is on confident form delivering a persona that's conflicted and determined to get to the truth without selling his soul to Satan. To that latter end, he must rely more and more on girlfriend ""Cathy"" (Jacqueline Bisset) who seems to be his only link with sanity as the maelstrom of events begins to get on top of him. It's famous for the car chase, and some of the scenes at the airport towards the end are directed really quite tensely but I can't pretend I liked the conclusion. After all the interweaving and duplicity, it all rather ran out of steam. The style of the production isn't exactly electric either, and in many ways it reminded me of a great many other similar style vehicles about rogue police officers created for A-list actors whose careers might be considered ""between genres"". That said it's still a good, solid, thriller with a few twists and a Vaughn who always managed to portray the sleazy characters naturally."
1976.0,Jezebel,"In 1850s Louisiana, the willfulness of a tempestuous Southern belle threatens to destroy all who care for her.","Half angel, half siren, all woman.","Drama, Romance",103.0,1938-03-26,en,6.998,206.0,0.9982,"Bette Davis, Henry Fonda, George Brent, Margaret Lindsay, Donald Crisp",William Wyler,"love of one's life, southern usa, self-destruction, new orleans, louisiana, louisiana, yellow fever, female protagonist, epidemic, pride, vanity, southern belle","This starts off really strongly with the arrival, on horseback, of the feisty ""Miss Julie"" (Bette Davis). She is the rather proud orphaned daughter of a wealthy southern family whom everyone wants to know and be seen with - even if she is a bit of a pain in the neck. It's ""Dill"" (a rather charmless Henry Fonda) who is the front runner for her rather vain affections but he is no push-over. Her desire to inappropriately wear a red gown to a formal ball initially elicits his reluctant support as he escorts her, but then the ensuing fallout ensures he flees leaving her alone and determined - to get him back. The onset of the plague forces her to flee to their plantation and he ends up there too - but with a significant complication. With her normally ordered life all askew, ""Miss Julie"" has to think, perhaps for the first time, not just about herself. I'm afraid, though that this film was just bit too much of a soap for me. Though Davis has loads of beans at the outset, the story rather manoeuvres us into a rather predictably sentimental cul-de-sac that's slightly cluttered up by the rather obnoxiously cocky ""Buck"" (George Brent). Donald Crisp and Spring Byington provide a bit of ballast now and again, but I just found this all rather disappointingly flighty and thin. A frustrated love story, yes - but I just needed much more of our original ""Jezebel"" and less of what her character became. I saw this very recently on a big screen and it is still, despite my reservations, a fine example of thoroughly well presented and opulent cinema with a star who very much owns the screen."
3062.0,42nd Street,"A producer puts on what may be his last Broadway show, and at the last moment a chorus girl has to replace the star.",The Greatest Musical hit the Screen Has Ever Known!,"Comedy, Drama, Romance",89.0,1933-03-11,en,6.91,194.0,0.8946,"Warner Baxter, Bebe Daniels, George Brent, Ruby Keeler, Guy Kibbee",Lloyd Bacon,"philadelphia, pennsylvania, musical, stage show, director, dog, broadway, pre-code, fainting, chorus girl, eviction, financial crisis",
31685.0,The Hunchback of Notre Dame,"Paris, France, 1482. Frollo, Chief Justice of benevolent King Louis XI, gets infatuated by the beauty of Esmeralda, a young Romani girl. The hunchback Quasimodo, Frollo's protege and bell-ringer of Notre Dame, lives in peace among the bells in the heights of the immense cathedral until he is involved by the twisted magistrate in his malicious plans to free himself from Esmeralda's alleged spell, which he believes to be the devil's work.",Impact! Power! Fire! Pathos! Drama!,"Drama, Romance, Horror",117.0,1939-12-29,en,7.297,202.0,2.4042,"Charles Laughton, Cedric Hardwicke, Thomas Mitchell, Maureen O'Hara, Edmond O'Brien",William Dieterle,"sibling relationship, paris, france, based on novel or book, unrequited love, racism, kindness, hunchback, notre dame cathedral, bell ringing, beggar clan, physical deformity, sanctuary, bell ringer, 15th century, gypsy woman, church asylum","Incredible film-making, bravo for real classics.

What a truly lavish and gorgeous film this is, thematically it pulls the emotions in different directions, and as a story it's as sharp as a tack. Boasting a quite incredible performance from Charles Laughton as the tragic bell ringer Quasimodo (no nomination Academy, are you flipping sure?), and sets that are simply out of this world, this film to me defines classic cinema.

Into the mix we get a radiant Maureen O'Hara as Esmeralda who lights up the screen in every scene she is in, it's a very special performance in view of it being her first lead US turn. However, really the film's triumph lies with its script, a very aware piece of writing encompassing political goings on and the corruption of the church set around the hunchback's tragic love. The make up of Laughton leaves an indelible image when brought into focus with the great detail of the surroundings, and the score is mightily appropriate.

All in all this film cost 2 Million Dollars for RKO Studios, one of their most expensive outlays, but they were rewarded in spades as the film was a monster success and here in the modern day age of cinema the film still stands up as a benchmark for great movie making. 9/10 || The is a wonderfully evocative version of the timeless Victor Hugo story of love, desire, cruelty and brutality in 1490's Paris. Charles Laughton turns in a tour de force performance as the physically and mentally disabled ""Quasimodo"" who is feared, loathed and ridiculed by the local population. When a wandering gypsy girl ""Esmerelda"" (quite possibly Maureen O'Hara's best ever performance) is found guilty of murder he rescues her and gives her sanctuary in the high bell tower of Notre Dame cathedral. Here she is easy prey for the already infatuated ""Frollo"" - superby depicted by Sir Cedric Hardwicke. What follows is the stuff of great literature adapted with adroit skill and sympathy by Sonya Levein (screenplay) and directed by William Dieterie. The use of light and shadow, Alfred Newman's nimble score and an authentic set (recreated in California) make this by far the best rendering of this story on film."
42045.0,Sweet Dreams,"The story of Patsy Cline, the velvet-voiced country music singer who died in a tragic plane crash at the height of her fame.","She fought harder, loved more and went further than most people ever dream","Drama, Music, Romance",115.0,1985-10-02,en,6.5,56.0,0.6004,"Jessica Lange, Ed Harris, Ann Wedgeworth, David Clennon, James Staley","Karel Reisz, Robert Getchell","country music, biography, historical figure, singer, fame, 1950s, 1960s",
12708.0,That Touch of Mink,"Cathy Timberlake is en route to a job interview when a car transporting businessman Philip Shayne covers her in mud. He sends his assistant, Roger, to apologize, but upon meeting Cathy, Roger knows that she would be a suitable match for his boss. Despite their mutual attraction, Cathy and Philip want different things. Philip wants a fling, while Cathy wants a marriage. As they travel to exotic locales, their differing motivations are put to the test.","Insistence! Resistance! Persistence! Co-Existence! It's the year's most uproarious, romantic free-for-all...!","Comedy, Romance",99.0,1962-06-14,en,6.429,175.0,1.0351,"Cary Grant, Doris Day, Gig Young, Audrey Meadows, Alan Hewitt",Delbert Mann,"new york city, romcom, blonde, travel, falling in love, screwball comedy, sex comedy, rich man",
11610.0,"Play It Again, Sam","A neurotic film critic obsessed with the movie Casablanca (1942) attempts to get over his wife leaving him by dating again with the help of a married couple and his illusory idol, Humphrey Bogart.","""It's still the same old story, a fight for love and glory.""*","Comedy, Romance",85.0,1972-05-04,en,7.491,606.0,1.0417,"Woody Allen, Diane Keaton, Tony Roberts, Jerry Lacy, Susan Anspach",Herbert Ross,"date, hallucination, make a match, dating, filmmaking, feet, ghost, neurotic, film critic",
4939.0,Send Me No Flowers,"At one of his many visits to his doctor, hypochondriac George Kimball mistakes a dying man's diagnosis for his own and believes he only has about two more weeks to live. Wanting to take care of his wife Judy, he doesn't tell her and tries to find her a new husband. When he finally does tell her, she quickly finds out he's not dying at all (while he doesn't) and she believes it's just a lame excuse to hide an affair, so she decides to leave him.","Rock is ready to make love yesterday, tomorrow, and especially to Day (Doris that is!)","Comedy, Romance",100.0,1964-10-14,en,6.718,134.0,0.6777,"Rock Hudson, Doris Day, Tony Randall, Paul Lynde, Hal March",Norman Jewison,"romcom, hypochondriac, misunderstanding, screwball comedy, sex comedy","Look, you're dealing with your wife. You can forget the Constitution.

Send Me No Flowers is directed by Norman Jewison and collectively written by Julius J. Epstein, Norman Barasch and Carroll Moore. It stars Doris Day, Rock Hudson, Tony Randall, Clint Walker, Edward Andrews, Paul Lynde and Patricia Barry. Music is by Frank De Vol and cinematography by Danial Fapp.

A hypochondriac believes he is dying and makes plans for his wife, which creates many misunderstandings for themselves and everyone around them...

The pairing of Hudson and Day was an utter joy, producing romantic comedy escapism from the upper echelons of such genre stations. Send Me No Flowers is the last of their collaborations, so how wonderful to find it to be a grand way to bow out.

In parts it's thunderously mirthful, even joyously tasteless in the process, in others it's mature and smart about the subjects to hand. Cast are on fire across the board, but this is undoubtedly Hudson's show all the way. He puts a gracefulness into what is a tricky role, while his sly comedic timing - both visually and vocally - is top dollar. 

This is a guaranteed bad mood lifter, a pic to blow away the black clouds for a while. The actors are great company to be in, the writing cunning with humorous intent. From some nifty animation at pic's start to introduce Hudson's character's hypochondria, to the sight of the hulking Clint Walker getting out of the world's smallest car! this never lets up on the passion to entertain us. 8/10"
25016.0,Pygmalion,"When linguistics professor Henry Higgins boasts that he can pass off Cockney flower girl Eliza Doolittle as a princess with only six months' training, Colonel George Pickering takes him up on the bet. Eliza moves into Higgins's home and begins her rigorous training after the professor comes to a financial agreement with her dustman father, Alfred. But the plucky young woman is not the only one undergoing a transformation.",He picked up a girl from the gutter - and changed her into a glamorous society butterfly!,"Comedy, Drama, Romance",96.0,1939-03-03,en,7.0,146.0,0.5181,"Leslie Howard, Wendy Hiller, Wilfrid Lawson, Marie Lohr, Scott Sunderland","Leslie Howard, Anthony Asquith, Ian Dalrymple","bet, professor, bath, transformation, tea, etiquette, elocution, based on play or musical, teacher, teacher student relationship, high society, guttersnipe, pygmalion, flower vendor, social class, class system, social reception, mother son relationship, speech lessons, taken for granted, phonetics, quick learner","Even though it was made some 25 years, or so, before ""My Fair Lady"" it still takes a few minutes before you get used to the fact that it has no singing... Once that has been established, we can enjoy a witty and pithy observation of class and superficiality that raises both smiles and heckles in equal measure. Leslie Howard is great as the somewhat snobbish phonetics expert (""Prof. Higgins"") who bets his pal ""Col. Pickering"" (Scott Sunderland) that he can take the gutturally linguistic flower girl ""Eliza"" (Wendy Hiller) and pass her off as a duchess to the highest of society. Hiller is super, too. She takes the role of the reluctant, naive but strong willed and savvy street seller by the scruff of the neck and before long we see that the Professor has more than met his match! His housekeeper ""Mrs. Pearce"" (Jean Cadell) has a go at umpiring now and again and there is a scene stealing performance from Esme Percy as the even more pompous ""Count Karpathy"" who is the one person ""Higgins"" fears may be able to rumble his deception. Right from the raucous and hilarious bathing scene, it sets off at quite a pace swiping relentlessly at the British societal system - ribbing snobs and workers alike as Bernard Shaw's story is transferred to celluloid in a way that (hopefully) the author would have appreciated too. I can't say I liked the ending of the play and I don't really much care for the ending here, either - but boy, it's one hell of a journey demonstrating creative skill at just about every turn."
40423.0,Black Orpheus,"Young lovers Orfeu and Eurydice run through the favelas of Rio during Carnaval, on the lam from a hitman dressed like Death and Orfeu's vengeful fiancée Mira and passing between moments of fantasy and stark reality. This impressionistic retelling of the Greek legend of Orpheus and Eurydice introduced bossa nova to the world with its soundtrack by young Brazilian composers Luiz Bonfá and Antonio Carlos Jobim.",The film that introduced Bossa Nova to the world...,"Drama, Romance",100.0,1959-06-12,pt,6.991,217.0,0.6512,"Breno Mello, Marpessa Dawn, Lourdes de Oliveira, Léa Garcia, Adhemar Ferreira da Silva",Marcel Camus,"guitar, rio de janeiro, samba, trolley, dancing in the street, based on myths, legends or folklore, detached, carnaval, demeaning","I reckon this was always going to be a bit of a creatively risky venture and for me: a Frenchman moving a Greek myth to the culturally diverse Brazil was always going to be quite an ask. It's colourful and well cast, but I am afraid the story just muddled up too many themes for me. The premiss is the same as the ancient story, with this time ""Eurydice"" (Marpessa Dawn) having fled her home town to avoid the unwelcome attentions of a suitor. She encounters tram driver ""Orfeu"" (Breno Mello) and pretty much instantly they hit it off. He serenades her with his carousing guitar music - despite the fact that he is already promised to ""Mira"" (Lourdes de Olivera). Guess what? ""Mira"" isn't too impressed with her boyfriend's philandering and when ""Eurydice"" goes off the grid amidst all the celebrations and colour that is mardi gras, ""Orfeu"" suspects everyone and must set off on a search that will test his mettle and his love - and put him in the path of death itself! I enjoyed the idea but somehow it just didn't quite work. Surely there must be local mythology that could have been better applied here? It reminded me a little of Preminger's ""Carmen Jones"" (1954) in that by simply relocating a classic story to a new and vibrant scenario, you lose quite a lot of what made the original story work in the first place - even if it is a timeless love story that ought, on paper, to be easily transferrable. There's no doubt, though, a cracking chemistry between Mello and Dawn and I did enjoy Olivera's performance too. There is some beautiful and captivating photography of Rio de Janeiro that does illustrate the vibrancy of the place, and it's a beautiful film to watch. The story? Well I'm not so sure it marries so well and there's just too much focus on the environment and not enough on developing the characters."
