tmdbId,title,overview,tagline,genres,runtime,release_date,language,vote_average,vote_count,popularity,cast,crew,keywords,reviews
17965.0,The Abominable Dr. Phibes,"After a team of surgeons botches his beloved wife's operation, the distraught Dr. Phibes unleashes a score of Old-Testament atrocities on his enemies.",Love means never having to say you're ugly.,"Horror, Comedy",94.0,1971-05-18,en,6.928,318.0,0.7837,"Vincent Price, Joseph Cotten, Hugh Griffith, Terry-Thomas, Virginia North",Robert Fuest,"mask, life and death, wife, loss of loved one, scotland yard, dark comedy, organ, inspector, revenge, murder, mute, religion, mad doctor, camp, doctor, biblical plagues, organ player, medical malpractice, art déco",
56137.0,I Know Where I'm Going!,"Plucky Englishwoman Joan Webster travels to the remote islands of the Scottish Hebrides in order to marry a wealthy industrialist. Trapped by inclement weather on the Isle of Mull and unable to continue to her destination, Joan finds herself charmed by the straightforward, no-nonsense islanders around her, and becomes increasingly attracted to naval officer Torquil MacNeil, who holds a secret that may change her life forever.",,"Romance, Drama, Comedy",91.0,1945-11-16,en,7.1,150.0,0.5953,"Wendy Hiller, Roger Livesey, Pamela Brown, Finlay Currie, George Carney","Michael Powell, Emeric Pressburger, Michael Powell, Emeric Pressburger","island, scotland, castle, whirlpool, bagpipe, hebrides, scotland, laird","This is a cracking outing for Wendy Hiller and Roger Livesey. The former is a young Englishwoman who gets engaged to an older, much wealthier businessman who invites her to join him on a remote Hebridean island. She arrives at an adjacent island, but is hemmed in by bad gales and so has to remain. During her enforced stay, she begins to socialise with the locals - including Livesey (the wonderfully Scottish ""Torquil MacNeill"") and despite herself she begins to fall for him and panic ensues. Powell & Pressburger have created a gentle, engaging romantic adventure film; well written with some great characters (John Laurie & Finlay Currie amongst them) that - along with the terrible weather - elicit a genuine feeling of the remoteness of these Scottish Islands and of the hospitality and canniness of their people. Peppered with humour and with a nail-biting ending, this is a super watch; one of their better films in my book."
33250.0,Real Life,"A pushy, narcissistic filmmaker persuades a Phoenix family to let him and his crew film their everyday lives, in the manner of the ground-breaking PBS series ""An American Family"".",An American Comedy,Comedy,99.0,1979-03-02,en,6.6,84.0,0.7164,"Albert Brooks, Charles Grodin, Frances Lee McCain, Lisa Urette, Robert Stirrat","Albert Brooks, Albert Brooks, Monica Johnson, Harry Shearer","dysfunctional family, mockumentary, filmmaking, documentary filmmaking, narcissist, psychological disintegration, family portrait, film director, film crew, social experiment, dull suburb, faux reality show",
14460.0,Battle Beyond the Stars,A young farmer assembles a band of diverse mercenaries to defend his peaceful planet from an evil tyrant.,"A battle beyond time, beyond space.","Science Fiction, Action, Adventure",104.0,1980-09-08,en,5.4,207.0,1.4133,"Richard Thomas, Robert Vaughn, John Saxon, George Peppard, Darlanne Fluegel",Jimmy T. Murakami,"hitman, clone, space battle, mercenary, space, space western, robot, explosion, space opera, space adventure, spaceship, good versus evil","This looks every inch the low budget affair it actually was - but it almost comes off as a fairly engaging sci-fi rip off of the ""Magnificent Seven"" - complete, even, with Robert Vaughn! ""John-Boy"" himself, Richard Thomas (""Shad"") lives on one of those simple, peaceful, planets threatened by a megalomanic with a big laser cannon (John Saxon) who demands their harvest. ""Shad"" decides to try and rustle together some mercenaries to defend their home from this evil conqueror and so recruits a disparate band including George Peppard (""Cowboy"") and a collection of inter-galactic misfits to help with their cause. Probably most notable for James Horner's score, this is an enjoyable enough sci-fi action adventure with plenty going on and not too much tedious philosophising; the special effects do their job fine, too. || **_Star Trek and Star Wars are met together (on a lower Corman budget)_**

When the planet Akir is threatened by a galactic tyrant (John Saxon), a young man with no experience in warfare (Richard Thomas) ventures into space to enlist the aid of several mercenaries (George Peppard, Robert Vaughn, Morgan Woodward, etc.).

""Battle Beyond the Stars"" (1980) meshes the space-oriented science-fiction of Star Trek (the Original Series and the 1979 movie) with the space fantasy of Star Wars for a colorful interplanetary adventure on a Roger Corman budget. The protagonist’s planet is called Akir and the denizens Akira because the basic plot was taken from Akira Kurosawa’s “Seven Samurai” (which, of course, was also the basis for “The Magnificent Seven”).

On the female front, Darlanne Fluegel is noteworthy as Nanelia, the potential mate of our young hero (Thomas). Meanwhile stunning Sybil Danning works well as Saint-Exmin of the Valkyrie warriors, albeit hammy. Julia Duffy can be observed as one of the Akira.

This was one of the first fairly big theatrical films to be scored by James Horner (although he previously did “Humanoids from the Deep” the same year), which paved the way for his notable career (think “Wolfen,” “Star Trek II,” “Star Trek III,” “Cocoon,” “Aliens,” “Field of Dreams,” “Glory” and so on).

Corman’s $2 million budget was mostly spent on the salaries of Peppard and Vaughn, but he had to up his game with the special effects to compete with the new standards set by “Star Wars” (which cost $11 million), “Alien” ($11 million) and “Star Trek: The Motion Picture” ($35 million). Sure, the F/X aren’t as good as those movies, technically speaking, but they’re quite effective (and fun) all things considered, not to mention superior to “Buck Rogers in the 25th Century” (the theatrical movie that was also the pilot for the TV series), which had $3.5 million to work with.

It was very profitable at the box office and deservedly so since it’s all-around entertaining. You could say that it was the low-budget precursor to the Thor and Guardians of the Galaxy flicks of modern times.

It runs 1 hour, 43 minutes and was shot at Corman's own studio in Venice, California, his ""renowned lumberyard facility.”

GRADE: B"
9594.0,Double Impact,"Jean Claude Van Damme plays a dual role as Alex and Chad, twins separated at the death of their parents. Chad is raised by a family retainer in Paris, Alex becomes a petty crook in Hong Kong. Seeing a picture of Alex, Chad rejoins him and convinces him that his rival in Hong Kong is also the man who killed their parents. Alex is suspicious of Chad, especially when it comes to his girlfriend.",One packs a punch. One packs a piece. Together they deliver...,"Thriller, Action, Crime, Drama",110.0,1991-07-31,en,6.2,1126.0,3.0474,"Jean-Claude Van Damme, Geoffrey Lewis, Alonna Shaw, Bolo Yeung Sze, Cory Everson",Sheldon Lettich,"martial arts, war veteran, fight, loss of loved one, fighter, villainess, karate, revenge, organized crime, hong kong, los angeles, california, twins, hoodlum, action hero","So there is a line in here that I identify with: ""Never in my life would I wear black silk underwear,"" and that really needs to be your only take away.

Because, honestly, what could be worse than Jean-Claude Van Damme's acting? Twice as much of Jean-Claude Van Damme's acting. There are two stars of this movie and he is both of them.

However, it does hit most of the tropes of boobs, fights, and guns. The only down side is that even with hitting all the tropes, it's still pretty unwatchable, even for a Jean-Claude Van Damme movie."
4986.0,Fuzz,Police in Boston search for a mad bomber trying to extort money from the city.,Here comes the fuzz,"Comedy, Crime, Drama",93.0,1972-07-14,en,5.523,43.0,1.2217,"Burt Reynolds, Jack Weston, Tom Skerritt, Raquel Welch, James McEachin",Richard A. Colla,blackmail,"_**87th Precinct yarn set in Boston with Burt Reynolds, Tom Skerritt and Raquel Welch**_

Detectives in Boston have to deal with several typical crime issues in the big city, including a money-hungry killer bomber (Yul Brynner). Burt Reynolds, Tom Skerritt, Raquel Welch and Jack Weston head the cast.

""Fuzz"" (1972) is an 87th Precinct tale based on the book of the same name and written by the author, Evan Hunter, aka Ed McBain. It’s similar in some ways to other big city detective flicks of that era, like “Bullitt” (1968), Dirty Harry (1971), “The Night Stalker” (1972) and “Deathwish” (1974), but it’s easily the least of these because (1) the attempt to shoehorn humor into the life-or-death proceedings, à la “M*A*S*H” (1972), seems forced and (2) the script tries to juggle too many separate incidents with too many characters.

One example of the strained humor is the painters working in the headquarters throughout. But some of the humor works. If they would’ve toned down these kinds of artificialities the movie would’ve worked better. But working out the kinks in scripts take time and time means money. 

In any case, if you can adapt to the movie’s peculiar tone there’s a lot to appreciate here, including the great cast, which includes many recognizable faces, like Charles Martin Smith, Steve Ihnat and Cal Bellini. It’s also worth noting that the film gets better as it moves along with the last act being the best. It was the obvious inspiration for the TV show Hill Street Blues.    

Fifteen months after its release, 24 year-old Evelyn Wagler was shockingly murdered in the rundown Blue Hill district of Boston in what might have been a copycat crime based on this movies’ depiction of bums doused with gasoline and set ablaze. What made this incident worse was that it appeared to be a racial hate crime, the victim being white and the six teen perps being black, as witnessed by Wagler before she succumbed to her injuries four hours after the crime. The thug scum were never caught.

The movie runs 1 hour, 32 minutes.

GRADE: B-/C+"
2453.0,Harley Davidson and the Marlboro Man,"It's the lawless future, and renegade biker Harley Davidson and his surly cowboy buddy, Marlboro, learn that a corrupt bank is about to foreclose on their friend's bar to further an expanding empire. Harley and Marlboro decide to help by robbing the crooked bank. But when they accidentally filch a drug shipment, they find themselves on the run from criminal financiers and the mob in this rugged action adventure.",Who says there are no more heroes?,"Action, Thriller",98.0,1991-08-23,en,6.304,452.0,2.1876,"Mickey Rourke, Don Johnson, Chelsea Field, Daniel Baldwin, Giancarlo Esposito",Simon Wincer,"drug dealer, corruption, los angeles, california, las vegas",
33676.0,Losin' It,"In 1965, four Los Angeles school friends -- Woody, Dave, Spider and Wendell -- go on a series of misadventures when they head to Tijuana, Mexico, for a night of cruisin', causing trouble, and to lose their virginity.",The last word...about the first time.,Comedy,100.0,1983-04-08,en,5.018,115.0,0.9872,"Tom Cruise, Jackie Earle Haley, John Stockwell, John P. Navin, Jr., Shelley Long",Curtis Hanson,"high school, prostitute, mexico, locker room, virginity",
4587.0,Mermaids,"Fifteen-year-old Charlotte Flax is tired of her wacky mom moving their family to a different town any time she feels it is necessary. When they move to a small Massachusetts town and Mrs. Flax begins dating a shopkeeper, Charlotte and her 9-year-old sister, Kate, hope that they can finally settle down. But when Charlotte's attraction to an older man gets in the way, the family must learn to accept each other for who they truly are.",Mom is many things... normal isn't one of them.,"Comedy, Drama, Romance",110.0,1990-12-14,en,6.7,534.0,1.8742,"Cher, Winona Ryder, Christina Ricci, Bob Hoskins, Michael Schoeffling",Richard Benjamin,"new year's eve, coming of age, dress, swimming, roman catholic church, sexual awakening, novice, john f. kennedy assassination, polka dot, gynecological exam, jewish girl, shoe salesman, polka dot dress, bell ringing, bell tower, 1960s, love story, sentimental, amused, compassionate",
11454.0,Manhunter,"FBI Agent Will Graham, who retired after catching Hannibal Lecter, returns to duty to engage in a risky cat-and-mouse game with Lecter to capture a new killer.","It's just you and me now, sport…","Crime, Horror, Thriller",120.0,1986-08-14,en,7.01,1411.0,0.1225,"William Petersen, Tom Noonan, Dennis Farina, Brian Cox, Kim Greist",Michael Mann,"journalist, loss of loved one, psychopath, fbi, investigation, covered investigation, full moon, cult, eye, serial killer, crime scene, brutality, videotape, depravity, neo-noir, 1980s, malevolence, homicide investigation, hannibal lecter","Recover the mindset.

Retired FBI specialist Will Graham is lured back into action to track a serial killer who is killing families, seemingly linked into the lunar cycle. In the process it opens up some old mental wounds that were born out during his last action out in the field...

Before the gargantuan success of Silence of the Lambs, where the name Hannibal the Cannibal moved into pop culture, and before director Michael Mann became a named auteur often referenced with relish by hungry film students; there was Manhunter, Michael Mann's brilliant adaptation of Thomas Harris' equally brilliant psychological thriller, Red Dragon. It feels a bit redundant now, years later, writing about Mann's use of styles to bear out mood and psychological states, his framing devices, his commitment to his craft, but after revisiting the film on Blu-ray, I find myself once again simultaneously invigorated and unnerved by the magnificence of Manhunter. Visually, thematically and narratively it remains a clinical piece of cinema, a probing study of madness that dares to put a serial killer and the man hunting him in the same psychological body, asking us, as well as William Petersen's FBI agent Will Graham, to empathise with Tom Noonan's troubled Tooth Fairy killer. Here's a thing, too, Francis Dolarhyde (The Tooth Fairy) is a functioning member of society, he is quite frankly a man who could be working in a shop near you! This is no reclusive psychopath such as, well, Buffalo Bill, Dolarhyde is presented to us in such a way as we are given insight into this damaged mind, he is fleshed out as a person, we get to know him and his motivational problems.

Dream much, Will?

Mann and his team are not about over the top or camp performances, gore is kept to a premium, the real horror is shown in aftermath sequences, conversations and harmless photographs, but still it's a nightmarish world. Suspense is wrung out slowly by way of the characterisations. Will has to become the killer, and it's dangerous, he knows so because he has done it before, when capturing Dr. Hannibal Lecktor. Needing to pick up the scent again, to recover the mindset, Will has to go see the good doctor who has a penchant for fine wines and human offal. These scenes showcase Mann at his deadliest, a bright white cell filmed off kilter, each frame switch showing either Lecktor or Graham behind bars, they are one. When Lecktor taunts Will about them being alike, Mann understands this and visually brings it out. Dolarhyde's living abode is murky in colour tones and furnished garishly, and with mirrors, paintings and a lunar landscape, yet when Dolarhyde is accompanied by Joan Allen's blind Reba, where he feels he is finally finding acceptance, this house is seen at ease because of the characterisations. Switch to the finale and it's a walled monstrosity matching that of a killer tipped back over the edge. Brilliant stuff.

If one does what God does enough times, one will become as God is.

Lecktor, soon to be back as the source material Lecter in the film versions that follow, is actually not in the film that much. Brian Cox (chilling, calculating, frightening and intelligent) as Lecktor gets under ten minutes of screen time, but that's enough, the character's presence is felt throughout the picture in a number of ways. The Lecktor angle is very relative to film's success, but very much it's one strand of a compelling whole, I realise now that Mann has deliberately kept us wanting more of him visually. Noonan is truly scary, he lived away from the rest of the cast during filming, with Mann's joyous encouragement, the end result is one of the best and most complex serial killer characterisations ever. Lang scores high as weasel paparazzi, Allen is heart achingly effective without patronising blind people and Farina is a huge presence as Jack Crawford, Will's friend and boss who coaxes Will back into the fray knowing full well that Will's mind might not make it back with him. But it's Petersen's movie all the way. His subsequent non film career has given ammunition to his knockers that he is no great actor. Rubbish, with this and To Live and Die in L.A. he gave two of the best crime film portrayals of the 80s. He immerses himself in Will Graham, so much so he wasn't able to shake the character off long after filming had wrapped. There's a scene in a supermarket where Will is explaining to his son about his dark place, where ""the ugliest thoughts in the world"" live, a stunning sequence of acting and a showcase for Petersen's undoubted talents.

Newcomers to the film and Mann's work in general, could do no worse than spend the ten minutes it takes to watch the Dante Spinotti feature on the disc. Apart from saving me the time to write about Mann's visual flourishes, it gives one an idea of just how key a director and cinematographer partnership is in a film such as this. The audio is crisp, which keeps alive the perfect in tone soundtrack and eerie scoring strains of Rubini and The Reds. Some say that the music of Manhunter is dated? I say that if it sits at one with the tonal shifts and thematics of a story then that surely can never be viewed as dated. And that's the case here in Manhunter. The director's cut is included as part of the package but the transfer is appalling, and for the sake of one cut scene that happens post the Dolarhyde/Graham face off, there's really not much to the DC version anyway. The theatrical cut is perfect, brilliantly realised on Blu-ray to birth a true visual neo-noir masterpiece. 10/10 || With ""Hannibal Lecktor"" (Brian Cox) now safely behind bars, the traumatised profiler ""Graham"" (William Petersen) might be looking forward to a well earned-retirement. Thing is, the ""Tooth Fairy"" has other plans as he embarks on a killing spree that causes his erstwhile FBI boss ""Crawford"" (Dennis Farina) to seek his help. These murders are truly gruesome with entire families killed, inside their own homes, on nights with a full moon. With the next one of those due very soon, ""Graham"" has to enlist the help of his former tormentor - whose help is never as straightforward as he might like - to see if they can establish some patterns and preempt more slaughter. Meantime, we are introduced to ""Dollarhyde"" (Tom Noonan) who's about eight foot tall and maybe not the most stable of photographers we are ever going to meet. It's possible that he might succumb to the more calming influence of the lovingly blind ""Reba"" (Joan Allen) but with the pressures mounting you wouldn't want to bet on that. Is there a connection? As with Thomas Harris's ""Red Dragon"" book, the audience is aware of far more than the pursuers and that works well here as we see ""Graham"" try to work from a blank canvas, and with an insane convict, to track down a man who has left virtually nothing for them to go on. Petersen holds this together quite well and the cleverly cast Cox, well he always comes across as an actor who'd be quite prepared to eat the competition. I found the ending just a little rushed, but the jigsaw is well presented and the jeopardy effectively increased throughout this quite chilling adaptation. Honestly - I didn't much care for the intrusively synthesised score - just a little too much ""Miami Vice"" for me - but this is a solid and at times quite gripping story of imbalance and mania that I did quite enjoy."
4192.0,Death on the Nile,"As Hercule Poirot enjoys a luxurious cruise down the Nile, a newlywed heiress is found murdered on board and every elegant passenger becomes a prime suspect.",A murderer strikes on board the luxury Nile steamer Karnak – and Hercule Poirot faces his most baffling case.,Mystery,140.0,1978-09-29,en,7.139,839.0,2.9454,"Peter Ustinov, Jane Birkin, Lois Chiles, Bette Davis, Mia Farrow",John Guillermin,"egypt, based on novel or book, paddleboat, pyramid, cruise, nile, sphinx, murder, cruise ship, whodunit, cobra, shipboard, murder mystery, 1930s","This a corker of a whodunnit - and what chance you could ever get a cast like this together again without it being a computer generated festival of egos? Mia Farrow, Jane Birkin, a scene-stealing Angela Lansbury, George Kennedy, Maggie Smith and an incomparable Bette Davis are all likely suspects as a fabulously wealthy Lois Chiles is bumped off in her cabin aboard a luxury cruise down the Nile. Luckily, though - for us, and them - Peter Ustinov and David Niven are on hand to resolve this mysterious crime. As the films develops you realise just how odious and horrid the murdered woman was - I found that I wanted to kill her too!! Great fun with a superb Nina Rota score that really makes this a diamond of a film. I read, with trepidation, that Sir Kenneth Branagh is to remake this in 2020 - hmmm!!!"
38718.0,Reversal of Fortune,"Wealthy Sunny von Bülow lies brain-dead, husband Claus guilty of attempted murder; but he says he's innocent and hires Alan Dershowitz for his appeal.",The Case of Claus Von Bulow. An American Saga of Money and Mystery.,Drama,111.0,1990-10-19,en,6.631,325.0,1.2369,"Glenn Close, Jeremy Irons, Ron Silver, Annabella Sciorra, Uta Hagen",Barbet Schroeder,"coma, based on novel or book, biography, murder, lawyer, based on memoir or autobiography, law student, socialite, legal drama, diabetes","Great performance from Jeremy Irons, well deserving of his Best Actor Academy Award, kind of is a letdown as both a legal and character drama. Some nice moments and solid performances from everyone but not sure I'll remember this one down the road. **3.5/5** || Quite why Jeremy Irons won an Oscar for this performance is anyone's guess. Though it is certainly one of his better efforts, he still comes across as remarkably wooden and un-engaging. His character - Klaus von Bulow - has just been convicted of attempting to marry his wealthy, socialite, wife Sonny (Glenn Close) by injecting her with drugs and leaving her to freeze to death on the bathroom floor (odd how they've got $14 million in the bank but never turn the central heating on!). Anyway, now she is lying in a coma and he is desperate so engages the services - at $300 a day, no less - of law professor Alan Dershowitz (upon whose book this is all based) to lead his appeal. It's history this, so if you're across the story then you will already know how it all pans out. Therefore what we are left with is a decent effort from Ron Silver as the tenacious lawyer, some almost ethereal contributions from Close as the occasionally animated corpse/narrator and the frankly underwhelming Irons. It's an interesting look at the drug-fuelled existence of the rich and famous and possibly not the best extolment of the state of marriage but somehow the whole thing is just a bit sterile, lacking, dry..."
14052.0,Revenge of the Nerds,"At Adams College, the jocks rule the school from their house on high, the Alpha Beta fraternity. So when a group of socially-challenged misfits try to go Greek, they're instantly rejected by every house on campus. Deciding to start their own fraternity to protect their outcast brothers, the campus nerds soon find themselves in a battle royale as the Alpha Betas try to crush their new rivals.","They've been laughed at, picked on and put down. But now it's time for the odd to get even!",Comedy,90.0,1984-07-20,en,6.472,758.0,1.5529,"Robert Carradine, Anthony Edwards, Timothy Busfield, Curtis Armstrong, Larry B. Scott",Jeff Kanew,"nerd, jock, panty raid, fire breathing, defenestration, funhouse, pie eating",
16889.0,Revenge of the Nerds II: Nerds in Paradise,"The members of the Lambda Lambda Lambda fraternity travel to Fort Lauderdale for a fraternity conference. They'll have to beat off the attacks of their rival frat, the Alphas, if they want to maintain their self-respect -- and, of course, if they want to get anywhere with the pretty girls!",They're Back!,Comedy,98.0,1987-07-10,en,5.572,277.0,1.5961,"Robert Carradine, Larry B. Scott, Timothy Busfield, Courtney Thorne-Smith, Anthony Edwards","Joe Roth, Dan Guntzelman, Steve Marshall","nerd, vacation, jock, frame up, defector",
26580.0,4 Little Girls,"On September 15, 1963, a bomb destroyed a black church in Birmingham, Alabama, killing four young girls who were there for Sunday school. It was a crime that shocked the nation--and a defining moment in the history of the civil-rights movement. Spike Lee re-examines the full story of the bombing, including a revealing interview with former Alabama Governor George Wallace.",On that Birmingham Sunday the blood ran like wine,Documentary,102.0,1997-07-09,en,7.261,46.0,0.3654,"Maxine McNair, Chris McNair, Helen Pegues, Queen Nunn, Arthur Hanes Jr.","Spike Lee, Spike Lee",,
