tmdbId,title,overview,tagline,genres,runtime,release_date,language,vote_average,vote_count,popularity,cast,crew,keywords,reviews
1995.0,Lara Croft: Tomb Raider,"Orphaned heiress, English aristocrat and intrepid archaeologist, Lara Croft, embarks on a dangerous quest to retrieve the two halves of an ancient artifact which controls time before it falls into the wrong hands. As an extremely rare planetary alignment is about to occur for the first time in 5,000 years, the fearless tomb raider will have to team up with rival adventurers and sworn enemies to collect the pieces, while time is running out. But, in the end, who can harness the archaic talisman's unlimited power?",Born into Wealth. Groomed by the Elite. Trained for Combat.,"Adventure, Fantasy, Action, Thriller",100.0,2001-06-11,en,5.9,6221.0,8.7795,"Angelina Jolie, Iain Glen, Daniel Craig, Noah Taylor, Chris Barrie",Simon West,"london, england, buddhist monk, planetary alignment, angkor wat, illuminati, william blake, steampunk, female protagonist, heiress, archaeologist, based on video game, aristocrat, sled dogs, relic, dead father, siberia, archeology, animate statue, lunar eclipse, tomb raiding","**Lara Croft: Tomb Raider captures the spirit of the games and casts the perfect actress as its lead. It's not a perfect film, but one it's still of the better video game adaptations ever made.**

Lara Croft: Tomb Raider had high expectations to overcome with legions of die-hard video game fans wanting to see everything they dreamed of on the big screen. With a perfect lead actress and a director known for wild action films, Tomb Raider was brought to life in one of the most faithful video game adaptations ever made (for better or worse). This movie brought the 2000s-era Tomb Raider games to life with all the style and camp of the decade - Matrix glasses, grunge rock, mediocre computer effects, and over-the-top action. While it wasn't a mind-blowing epic, it was a fun ride that captured some of the Indians Jones meets James Bond style of the games. Angelina Jolie was born to play this role and nailed the look and strength of Lara Croft and looked like she had a blast doing it too. Throw in Daniel Craig before he was Bond and every video game movie's villain, Ian Glen, and you got yourself a ridiculous 2000s action flick that nails the Tomb Raider spirit of that time. With the same vibe and effects of the Resident Evil movie franchise, Tomb Raider has flaws, but it's still a lot of fun. Don't take it too seriously and you will have a good time. || I thought this was a good movie to bring to life from a video game. Angelina Jolie was the perfect person for this role. It's pretty much like the video game. || Angelina Jolie brings loads of energy and attitude to this action-packed CGI fest. She's the eponymous daughter of a titled archaeologist who lives at (and regularly wrecks) her family's Buckinghamshire manor house. She's at an auction where an ancient gizmo sells for way over the odds. She manages to procure said bejewelled object and next thing her house is being attacked and the piece is stolen. She now has to use all of her wits and considerable ninja skills to track it down and that involves following it's trail to an ancient site that's long been hidden in China's icy wastes. It's all very formulaic, yes, but with Daniel Craig and Iain Glen adding to the duplicity and even the odd appearance from her motivational dad (Jon Voight) it brings the video game to life quite enthusiastically. Jolie proves to be quite a charismatic lead and the visual effects do their job adequately mingling the ""Stargate"" with the ""Mummy"" quite impressively. Nope, it will never trouble a BAFTA jury but as a piece of adventure cinema it's perfectly watchable with a lively soundtrack and a constantly moving storyline."
10808.0,Dr. Dolittle 2,"A group of beavers ask Dr. Dolittle to save their habitat from loggers. The only hope is to get the forest preserved because it's the home of a protected bear, but there's a problem: the bear's the only bear in the forest, so she can't reproduce. Undaunted, Dolittle persuades a circus bear to help out, but he has to teach him not just the ways of the wild, but the wiles of lady bears too.",The doctor is in again.,"Comedy, Family, Romance, Fantasy",87.0,2001-06-22,en,5.314,1697.0,2.5869,"Eddie Murphy, Kristen Wilson, Kyla Pratt, Raven-Symoné, Steve Zahn",Steve Carr,"veterinarian, forest, anthropomorphism, bear, animals, nature, animal protection, helping",
9799.0,The Fast and the Furious,"Dominic Toretto is a Los Angeles street racer suspected of masterminding a series of big-rig hijackings. When undercover cop Brian O'Conner infiltrates Toretto's iconoclastic crew, he falls for Toretto's sister and must choose a side: the gang or the LAPD.","If you have what it takes, you can have it all.","Action, Crime, Thriller",106.0,2001-06-22,en,6.993,10306.0,1.3992,"Paul Walker, Vin Diesel, Michelle Rodriguez, Jordana Brewster, Rick Yune",Rob Cohen,"street gang, undercover, car race, auto-tuning, street race, los angeles, california, aftercreditsstinger, duringcreditsstinger, based on magazine, newspaper or article","***Kinetic, “hip” street-racing flick with Vin Diesel and Paul Walker***

A newbie to Los Angeles (Paul Walker) falls for a café host (Jordana Brewster) while trying to join a street-racing gang led by her brother, Dom Toretto (Vin Diesel). Meanwhile the LAPD are trying to apprehend a radical group on the highways that targets semis and their valuable cargo. Michelle Rodriguez is on hand as Dom’s babe while Matt Schulze plays an angry member of his gang.

“The Fast and the Furious” (2001) was the beginning of the popular street-racing franchise that currently has eight movies with two more planned. The over-the-top action is akin to “The Road Warrior” (1981) while the tone mixes the comic book melodrama of “The Warriors” (1979) and “Torque” (2004) with the more serious air of “Grand Canyon” (1991) and “Training Day” (2001). (Yes, I realize “Torque” and “Training Day” debuted after this one; I’m just providing comparative references). 

Speaking of the tone, there’s no goofiness and the actors take everything dead seriously, which is good in my book, but the flick has several unintentional laughs because, while quasi-realistic, the thrills & posing are so exaggerated.

Brewster and Rodriguez are effective in the feminine department, but neither do much for me personally. There are a few good-looking ladies in the periphery, however.

The soundtrack contains several dynamic urban numbers, including the excellent “Deep Enough” by Live.

The movie runs 1 hour, 46 minutes and was shot in Los Angeles & nearby areas (San Bernardino, Hemet, Malibu, Westminster, Beverly Hills, etc.).

GRADE: B || I can’t call this film a legend. The film, which gave a big push in such a concept as street racing and tuning cars. He raised interest in illegal races on the night streets, gave life to such a renowned game like Need for Speed: Underground, which in turn gained countless fans. And maybe the storyline is really simple and without frills, but its implementation is worthy of deep respect. || Point Break with cars! Sure it is a little cheesy but in the best way. Fun cast and fun premise. Diesel, Walker, Rodriguez, and Brewster deliver a great movie.

**Once again, Point Break with cars. Do you need more?**"
644.0,A.I. Artificial Intelligence,"David, a robotic boy—the first of his kind programmed to love—is adopted as a test case by a Cybertronics employee and his wife. Though he gradually becomes their child, a series of unexpected circumstances make this life impossible for David.","David is 11 years old. He weighs 60 pounds. He is 4 feet, 6 inches tall. He has brown hair. His love is real. But he is not.","Drama, Science Fiction, Adventure",146.0,2001-06-29,en,7.046,6327.0,7.0651,"Haley Joel Osment, Jude Law, Frances O'Connor, Sam Robards, Jake Thomas",Steven Spielberg,"android, prostitute, artificial intelligence (a.i.), prophecy, loss of loved one, extraterrestrial technology, fairy tale, dystopia, adoption, ice age, prosecution, gigolo, hologram, alien, robot, destiny, capture, doppelgänger, human android relationship, robot boy, advanced technology","I bought this on DVD many years ago, convinced I had never seen it. I finally got around to watching it, and it wasn’t until I reached the robot demolition circus (words I bet I have never seen in the same sentence before) that I realized I had watched this movie before. That is a memorable sequence.

In many respects I thought the movie was well made: the special effects, the deep thinking behind the plot, and the writing was mostly good. It almost felt like it was covering too much ground, and I felt there were a few lapses. I will mention only one, and try not to give anything away. There is a pivotal scene where John Hurt’s character is with the AI child David. It took a lot of effort to get David there, so what does the guy do/ he leaves David alone and unchaperoned. And the end of the movie turns on that. Why would he wander off like that except to serve the plot?

Still, the film, mirroring and projecting the story of Pinocchio into the future, was quite an achievement. I liked it, but not as much as a lot of other Spielberg efforts. || The movie was actually pretty good. The ending sucked to me though. || With their son ""Martin"" supposedly out for the count, ""Henry"" (Sam Robards) procures a solution for his wife ""Monica"" (Frances O'Connor) in the form of ""David"" (Haley Joel Osment). He is a state of the art android. Not robotic in function like previous models, but an adaptive model that can learn to love, to feel, to be... Initially very apprehensive, she gradually bonds with the curious and friendly young man just as readily as dad ""Henry"" starts not to. Then, re-enter ""Martin"" (Jake Thomas) who turns out to be a rather malevolent and jealous lad who, with his fellow human friends, contrives a scenario that results in ""David"" becoming abandoned with only his talking ""Teddy"" for company. Now ""David"" had learned of the famous ""Blue Fairy"" who could turn him into a real boy, so convinced that his mother would love him again, sets out to track it down at the end of the Earth. His adventures along the way are perilous, he meets some salvage hunters with an almost circus-like approach to recycling before alighting on ""Gigolo Joe"" (Jude Law). His name says it all, his job being to ""pleasure"" women who want something that bit special. The two share his quest as the latter is pursued by the authorities - but can ""David"" reach his holy grail? This is heavily based on the ""Pinocchio"" story and that gives it a solid, potent and dark bedrock for a story of wishing for the moon. Osment is super here as the vulnerable but determined and lost lad looking for a mother's love and affection. Law also reminds us why he was ever an A-lister with an almost Astaire-esque performance as the ostensible wastrel who has more substance to his character than we might expect. The last half hour takes it's time, that could do with being tightened up - but the whole gist of this story of being careful what you wish for is otherwise well balanced between the drama, the emotion, a bit of technology and some fun too. It takes a swipe at the temporary culture that has prevailed for generations and maybe just reminds us that if it seems to good to be true, then it almost certainly is. Looks great on a big screen and is Spielberg at his most sensitively imaginative."
10691.0,Crazy/Beautiful,"At Pacific Palisades High, a poor Latino falls hard for a troubled girl from the affluent neighborhood.",When it's real. When it's right. Don't let anything stand in your way.,"Drama, Romance",99.0,2001-06-29,en,6.6,347.0,1.3015,"Kirsten Dunst, Jay Hernandez, Bruce Davison, Herman Osorio, Miguel Castro",John Stockwell,"lovesickness, jealousy, love of one's life, parent child relationship, forbidden love, kiss, crush, teenage crush, relationship, unhappiness",
16161.0,Baby Boy,"The story of Jody, a misguided, 20-year-old African-American who is really just a baby boy finally forced-kicking and screaming to face the commitments of real life. Streetwise and jobless, he has not only fathered two children by two different women-Yvette and Peanut but still lives with his own mother. He can't seem to strike a balance or find direction in his chaotic life.",Just a Baby Boy.,"Crime, Drama, Romance, Thriller",130.0,2001-06-27,en,7.136,324.0,3.2245,"Tyrese Gibson, Taraji P. Henson, Omar Gooding, Ving Rhames, Snoop Dogg","John Singleton, John Singleton","bootlegger, single parent, intolerance, fistfight, condom, stepfather, womanizer, thief, domestic violence, gunfight, los angeles, california, physical abuse, ex-con, selfishness, passive aggression, fatherhood, convicted felon, hostile, south central los angeles, vindictive, antagonistic",Movie was pretty good. Just another movie with a bad ending.
10615.0,Pootie Tang,"Pootie Tang, the musician/actor/folk hero of the ghetto, is chronicled from his early childhood to his battles against the evil Corporate America, who try to steal his magic belt and make him sell out by endorsing addictive products to his people. Pootie must learn to find himself and defeat the evil corporation for all the young black children of America, supatime.",Too cool for words.,"Action, Comedy",81.0,2001-06-29,en,5.047,158.0,1.0576,"Lance Crouther, Jennifer Coolidge, JB Smoove, Reg E. Cathey, Robert Vaughn","Louis C.K., Louis C.K.","ladykiller, belt, police officer, drug lord",
47596.0,Let It Snow,Two young lovers meet on a series of snowy days in high school.,To win back Sarah all James needs is a snow day... Too bad it's June.,"Comedy, Romance",90.0,1999-10-01,en,4.2,4.0,0.3321,"Kipp Marcus, Alice Dylan, Bernadette Peters, Larry Pine, Henry Simmons","Kipp Marcus, Adam Marcus",,
11826.0,Sexy Beast,"Ex-safecracker Gal Dove has served his time behind bars and is blissfully retired to a Spanish villa paradise with a wife he adores. The idyll is shattered by the arrival of his nemesis Don Logan, intent on persuading Gal to return to London for one last big job.",Yes or yes?,"Crime, Thriller, Drama",89.0,2000-09-13,en,6.988,814.0,2.0783,"Ray Winstone, Ben Kingsley, Ian McShane, Amanda Redman, James Fox",Jonathan Glazer,"gangster, psychopath, heist, money, murder, criminal, retired, hunting, safecracker, leisure, neo-noir, ambiguous","But quite frankly your attitude appalls me. It's not what you're saying. It's all this stuff you're not saying. Insinnuendos.

Sexy Beast is directed by Jonathan Glazer and written by Louis Mellis and David Scinto. It stars Ray Winstone, Ben Kingsley, Ian McShane, Amanda Redman, Cavan Kendall, James Fox and Julianne White. Music is by Roque Baños and cinematography by Ivan Bird. 

Retired to the Costa del Chill Out, retired thief Gary 'Gal' Dove (Winstone) finds his tranquil existence shattered when menacing gangster Don Logan (Kingsley) arrives on the scene demanding Gal goes back to London to do another job. 

2000 saw a slew of British gangster films released. The success of ""Lock Stock and Two Smoking Barrels"" opened the door for film makers keen to do their bit for Brit Grit. As is always the way, quality varies, but the class of 2000 had a healthy rate of good 'uns, of which Sexy Beast is a proud operator. 

The story is very thin, very film noir, an ex bad boy doing one last job that risks everything he has settled down for, but there's a panache to how the makers construct the tale. It helps that it's boosted by a ferocious performance from Kingsley, who is given licence to unleash his dark half, as he swears, stares, gets violent and has a general disregard for anyone but himself. 

Director Glazer, in what was his film after breaking out from advertisements and music videos, shows a keen eye for stylist visuals and attention grabbing scenes. He opens with an outrageous sequence of Gal sun bathing by his pool, the sun burning down, and then a giant boulder thunders into view and lands in the pool! All set to the sound of ""The Stranglers"" single ""Peaches"". Quite a way to announce yourself in film. 

The first half of film is the best, set at Gal's Spanish villa, Glazer neatly frames the characters (Gal lives with his wife and his two friends from England live nearby) as they bicker and cower in the shadow of Logan, who wouldn't be beyond sending them all to hell if he doesn't get his way. It's sweaty and tense, a coiled spring like atmosphere tells us something is going to give - and it does. The second half of the piece is not so tense or thrilling, though the robbery has a whiff of genius about it, but the pay off works well because Gal has earned our respect, as has his fellow sun seekers. Sexy Beast is not just sexy (tongue in cheeks for the makers), it's beefy and brutal, but also strangely beautiful as well. Nice. 8/10 || The other day, my lady Tammy and I watched director Glazer's recent 'Under the Skin' and loved its otherworldly wackiness and ambience, and as I had his first two films on DVD, we decided that at the very least, this first one demanded immediate investigation. I've adored Ray Winstone's work since his early days working in the films of Sir Alan Clarke, and Ben Kingsley's always a treat. Watching the characters brought back such awesome memories of my teenage days, travelling throughout England and continental Europe in December, 1986, as well. We can't wait to hopefully check out 'Birth' later this week...This was definitely one of the best and most original British gangster movies since the likes of 'The Long Good Friday' and 'Mona Lisa' from that era... || Ben Kingsley is great in this ultimate comedy heist movie. He is sent to wrest ""Gal"" (Ray Winstone) and his wife ""Deedee"" (Amanda Redmnan) from their well earned retirement (from the criminal fraternity) in Spain. Initially, they want nothing to do with ""Logan"" and his scheme, but a series of almost surreal events and a negotiation that can really only be describe as unique (and vaguely devilish) soon have them reunited with ""Teddy"" (Ian McShane) and plotting away merrily. Meantime, ""Gal"" is having some really curious dreams - and he is soon struggling to differentiate between reality and his vibrant and menacing visions. The standard thread of the story isn't much to write about, but the characterisations do make a difference here. The usually wooden Winstone works really well contrasting his hard-nosed criminal with his almost sentimental love for his wife and family. She, an erstwhile ""adult entertainer"" proves just as robust as him and even the unremarkable McShane has something about him that reminded me of why he was ever a charismatic success in ""Lovejoy"" in the first place. The plaudits do, however, go to Kingsley. Aided by a humorous and pithy script, he delivers the frankly monstrous and obnoxious character with his tongue in his cheek and a thinly veiled threat never far from his lips. I loved the last twenty minutes or so as the thing comes to an head and with plenty of twisting and writhing going on, it's anything but predictable. None of my favourite acting talent here, but hats off to Jonathan Glazer for pulling off a clever and sophisticated, yet rough and potent drama."
11444.0,The Closet,"A man spreads the rumor of his fake homosexuality with the aid of his neighbor, to prevent his imminent firing at his work.","Sometimes to save your skin, you have to come out of the closet... or go in!",Comedy,84.0,2001-01-17,fr,6.418,500.0,1.5191,"Daniel Auteuil, Gérard Depardieu, Thierry Lhermitte, Michèle Laroque, Michel Aumont","Francis Veber, Francis Veber","factory worker, coming out, factory, condom, bluff, kündigung, male homosexuality, neighbor, pretending to be gay, gay theme",
9301.0,The Princess and the Warrior,"Young nurse Sissi lives a secluded life entirely devoted to her patients at Birkenhof asylum. Her first encounter with ex-soldier and drifter Bodo has a lasting impact. He causes an accident in which he provides first aid, Sissi wonders if he may be the man of her dreams. But when she finds him weeks later she is rejected, as Bodo is stuck somewhere between a traumatic past and a criminal future.",Somewhere Out There You Can Find Love,"Romance, Drama",135.0,2000-10-12,de,6.962,130.0,0.3884,"Franka Potente, Benno Fürmann, Joachim Król, Lars Rudolph, Ludger Pistor",Tom Tykwer,"nurse, life-saver, romance, bank robbery",
60670.0,The Crimson Rivers,"Two French policemen, one investigating a grisly murder at a remote mountain college, the other working on the desecration of a young girl's grave by skinheads, are brought together by the clues from their respective cases. Soon after they start working together, more murders are committed, and the pair begin to discover just what dark secrets are behind the killings.",Evil rises to new heights.,"Crime, Mystery, Thriller",106.0,2000-09-27,fr,6.93,1596.0,2.0567,"Jean Reno, Vincent Cassel, Nadia Farès, Dominique Sanda, Karim Belkhadra","Mathieu Kassovitz, Jean-Christophe Grangé","skinhead, based on novel or book, nun, ritual, detective, village, mountain, investigation, drug use, murder, serial killer, corpse, demon, policeman, graveyard",
10992.0,Cats & Dogs,"When a professor develops a vaccine that eliminates human allergies to dogs, he unwittingly upsets the fragile balance of power between cats and dogs and touches off an epic battle for pet supremacy. The fur flies as the feline faction, led by Mr. Tinkles, squares off against wide-eyed puppy Lou and his canine cohorts.",Things Are Gonna Get Hairy!,"Family, Comedy, Action, Adventure, Fantasy",87.0,2001-07-04,en,5.392,1666.0,2.5582,"Jeff Goldblum, Elizabeth Perkins, Alexander Pollock, Miriam Margolyes, Tobey Maguire",Lawrence Guterman,"martial arts, hero, fight, cat, spy, secret organization, villain, governance, puppy, talking dog, allergy, dog, cat vs dog, talking cat, pets",
2140.0,Kiss of the Dragon,"Liu Jian, an elite Chinese police officer, comes to Paris to arrest a Chinese drug lord. When Jian is betrayed by a French officer and framed for murder, he must go into hiding and find new allies.",Kiss Fear Goodbye,"Action, Crime, Thriller",98.0,2001-07-06,en,6.9,1247.0,2.8254,"Jet Li, Bridget Fonda, Tchéky Karyo, Ric Young, Burt Kwouk",Chris Nahon,"martial arts, prostitute, paris, france, drug smuggling, gangster, conspiracy, police corruption, drugs, framed for murder, action hero","_**Jet Li flick in Paris with Bridget Fonda**_

An expert Chinese intelligence agent (Jet Li) is sent to Paris to help the head inspector (Tchéky Karyo) in apprehending a Chinese mob boss at a ritzy hotel, unaware that it’s a set-up. Bridget Fonda plays an American prostitute that “Johnny” (Li) develops a relationship with during the misadventure.

""Kiss of the Dragon"" (2001) is a big city crime thriller with the expected overdone martial arts action due to Li. It’s a modern mixing of “From Russia with Love” (1963) with the preposterous action of “The Gauntlet” (1977) and the martial arts of “Enter the Dragon” (1973).  It was Bridget’s second to last theatrical movie before calling it a day (although she also did some TV work in 2001-2002, like her final piece “Snow Queen”).

I like the fact that the protagonist, Liu Jian (Li), is confident and an expert fighter, but also very human, even meek, as a stranger in a strange land (being his first visit to Paris). The action is thrilling with a sense of style counterbalanced by some quality drama with Fonda’s character and her situation.
 
If I were to nitpick, some eye-rolling elements bring down the film’s quality. For instance, Liu Jian storms a police building, opens a door and suddenly enters a dojo full of martial arts guys ready to take him down. Why Sure!  Earlier, a British pilot grabs not one, but two Uzis to kill Liu Jian in the swank lobby, shooting up the entire place. Did he really need to cause mass devastation to kill one Chinese man? I'm sure the corrupt Inspector (Tchéky Karyo) wouldn't enjoy explaining the wholesale desolation to the mayor.   

Moreover, there are too many hip-hop songs on the soundtrack. I could see one or two (at the most), but they overdid it. It smacked of trying to be too ‘hip.’

The film runs 1 hour, 38 minutes and was shot entirely in Paris & nearby Seine-Saint-Denis, France.

GRADE: B-"
4248.0,Scary Movie 2,"While the original parodied slasher flicks like Scream, Keenen Ivory Wayans's sequel to Scary Movie takes comedic aim at haunted house movies. A group of students visit a mansion called ""Hell House,"" and murderous high jinks ensue.",More merciless. More shameless.,Comedy,82.0,2001-07-04,en,5.803,4810.0,8.7074,"Anna Faris, Regina Hall, Shawn Wayans, Marlon Wayans, Christopher Masterson",Keenen Ivory Wayans,"exorcism, haunted house, parody, spoof, horror spoof, secret door, college student, school project, haunted mansion, horror parody",
