tmdbId,title,overview,tagline,genres,runtime,release_date,language,vote_average,vote_count,popularity,cast,crew,keywords,reviews
10719.0,Elf,"When young Buddy falls into Santa's gift sack on Christmas Eve, he's transported back to the North Pole and raised as a toy-making elf by Santa's helpers. But as he grows into adulthood, he can't shake the nagging feeling that he doesn't belong. Buddy vows to visit Manhattan and find his real dad, a workaholic.","This holiday, discover your inner elf.","Comedy, Family, Fantasy",97.0,2003-11-07,en,6.655,4217.0,3.9117,"Will Ferrell, James Caan, Bob Newhart, Ed Asner, Mary Steenburgen","Jon Favreau, David Berenbaum","elves, dwarf, holiday, adoption, santa claus, sarcasm, looking for  birth parents, romance, fish out of water, orphan, north pole, christmas spirit, christmas, workshop, father son relationship, hilarious, cheerful","Okay, this is a fun movie, what I consider to be one of those classic Christmas movies I am willing to watch every year. And for me, that is a fairly short list, such as A Christmas Story and the ubiquitous It’s a Wonderful Life. (Interestingly, Peter Billingsley, who plays the lead Ralphie role in A Christmas Story, has an adult role in Elf.)

The script goes over the top a bit sometimes, resulting in cringeworthy moments for me, but it is harmless and easily forgiven. There is wit, pathos and sight gags galore. I like the chemistry between Will Farrell and Zooey, and it is a treat to have national treasures Ed Asner and Bob Newhart leading off the film as Santa and the Papa elf. James Caan and Mary Steenburgen are credible as Elf’s prospective new family in New York City.

So there is not a lot of depth to this movie, nor is there supposed to be. It is a great film to watch with friends or extended family. It shouldn’t offend anyone and you can visit with each other, because you don’t have to pay close attention to the plot. In fact, many viewers will be able to recite he lines along with the characters. || Good watch, will likely watch again, and can recommend.

For all the good this movie has in it, there is a fair amount of annoying as well, which is what keeps it from being a great movie.

A family reconnection trope, with a character out of his element trope, crossed with one of the most annoyingly positive characters of all time trope.

Ultimately, it's a sweet, hear warming story that really captures the spirit of family, Christmas, and togetherness.

It also captures all of the insanity Will Ferrell can conjure up for his character, basically as if he wrote a SNL Christmas special and just rode rough shod over the other actors.

The cast does a wonderful job of backing up Will Ferrell, but that's clearly what it is.

Around the holidays, especially, don't be afraid of giving this a try, and bear through the annoying bits, because there is likely something really funny just about to happen. || _**Destined to be played on TV every Christmas the rest of your life**_

Released in 2003 and directed by Jon Favreau, ""Elf"" is a Christmas dramedy/fantasy starring Will Farrell as an orphaned infant who stows away on Santa Claus' sleigh and isn't discovered until he's at the North Pole, where he's adopted by Papa Elf and named Buddy. After growing up as an elf, he travels to New York City to meet his father (James Caan) and starts a relationship with his neglected younger half-brother. He also starts a relationship with a department store worker (Zooey Deschanel) and helps spread Christmas cheer as Santa (Ed Asner) arrives to the city.

This is an all-around entertaining Christmas flick highlighted by Farrell's goofiness as the quasi-elf. It's fun with consistent laughs, not to mention a nice Christmas moral.

The film runs 97 minutes and was shot in New York City and Vancouver.

GRADE: B+"
23995.0,Billabong Odyssey,Action sports documentary that follows the industry's best big wave surfers as they travel the world searching for the largest waves that nature has to offer.,,"Action, Adventure, Documentary",88.0,2003-11-07,en,8.0,3.0,0.058,"Ken Bradshaw, Ken Collins, Brian L. Keaulana",Philip Boston,surfing,
1277.0,Gloomy Sunday,"Budapest in the thirties. The restaurant owner Laszlo hires the pianist András to play in his restaurant. Both men fall in love with the beautiful waitress Ilona who inspires András to his only composition. His song of Gloomy Sunday is, at first, loved and then feared, for its melancholic melody triggers off a chain of suicides. The fragile balance of the erotic ménage à trois is sent off kilter when the German Hans goes and falls in love with Ilona as well.",,"Drama, Romance",112.0,1999-10-21,de,7.8,63.0,1.5743,"Erika Marozsán, Joachim Król, Ben Becker, Stefano Dionisi, András Bálint",Rolf Schübel,"lovesickness, jealousy, budapest, hungary, nazi, birthday, blackmail, holocaust (shoah), deportation, jew persecution, hungary, menage a trois, sexual harassment, antisemitism",
11846.0,Father of the Bride,"George Banks is an ordinary, middle-class man whose 22 year-old daughter Annie has decided to marry a man from an upper-class family, but George can't think of what life would be like without his daughter. His wife tries to make him happy for Annie, but when the wedding takes place at their home and a foreign wedding planner takes over the ceremony, he becomes slightly insane.",Love is wonderful. Until it happens to your only daughter.,"Comedy, Romance",105.0,1991-12-20,en,6.461,1398.0,1.814,"Steve Martin, Diane Keaton, Kimberly Williams-Paisley, Kieran Culkin, George Newbern",Charles Shyer,"daughter, wedding planner, bride, son-in-law, father-in-law, fool, remake, los angeles, california, wedding, father daughter relationship",
508.0,Love Actually,Eight very different couples deal with their love lives in various loosely interrelated tales all set during a frantic month before Christmas in London.,The ultimate romantic comedy.,"Comedy, Romance, Drama",135.0,2003-09-07,en,7.105,6993.0,6.8213,"Hugh Grant, Alan Rickman, Emma Thompson, Liam Neeson, Martine McCutcheon",Richard Curtis,"london, england, usa president, rock star, school performance, love at first sight, holiday, war on terror, marseille, france, office, christmas party, language barrier, prime minister, press conference, bars and restaurants, valentine's day, heathrow airport, multiple storylines, christmas, lighthearted","God only knows what I'd be without you.

London, England, and it's the run up to Christmas, and we are in the company of a number of couples dealing with the joys and problems that love can bring.

We open with a narration from Hugh Grant who tells us that when he is troubled by the hate in the world, he thinks of the arrivals area of Heathrow airport. A place where loved ones greet returning loved ones, a place that indeed showcases a strand of love in its joyous form. He further ventures that when the aeroplanes hit the twin towers on 9/11, as far as he knows, all those phone calls from those sadly involved were messages of love, not hate. Pertinent musings that although somewhat sombre for an opening, sets it up nicely for what Richard Curtis (writer and director) wants to say.

A roll call of fine British and Irish actors, and American Laura Linney, lend their considerable talents to Curtis' ensemble piece. The structure is surprisingly simple considering the number of stories being woven together, the result being that there is sure to be a story in there to either love, or, yes, even hate. Is it sentimental? Of course. Is it as stuffed as a turkey on Xmas day? Naturally. Does it stretch credibility in some strands? For sure. But only the coldest of hearts could truly decry that Love Actually is all around. Very often it's funny too. Curtis, following on from writing credits such as Four Weddings And A Funeral, continues to show himself to be a very fine writer of comedy. None more so than with Bill Nighy's past his sell by date pop star, Billy Mack. There's something for everyone in here, indeed there's likely to be something that many can associate with.

It's a lovely affecting film that should hopefully perk up those that get blue around the holiday season. With perceptive writing, some excellent acting (Nighy, Emma Thomson, Colin Firth et al) and a soundtrack of some worth, Love Actually is a winner. 8/10 || Love Actually coulda been somebody; it coulda been a contender. There were scenes and characters I loved, but the movie was all but ruined by the irritatingly bad bits.  They could have dropped two entire  subplots and raised the quality considerably: I am thinking pf the needlessly crass over the hill singer with the Christmas song competition, and the male fantasy thread about the idiot going to Wisconsin and encountering three shapely nymphomaniacs. The time saved cutting those scenes could have been allocated to Laura Linney’s special needs brother and her infatuation, a plot that just petered out near the end, and to the Emma Thompson character’s marriage, which showed promise but similarly fizzled out with a half-hearted scene at the end. Or they could have given more screen time to Natalie, the prime minister’s love interest, who stole a few scenes and deserved many more.

So it was fun in places and touching at other times, and I can just about see myself watching this star-studded near-miss again, as long as I can keep a finger on the fast forward button. || **Bringing together several plots, the film is not about love, but about Love in its most diverse facets… and not always happy.**

Unlike most romantic movies, which stick to a sugary story and follow it to the end, with the invariable marriage at the end, and everything in rosy, this movie seems to care more about love itself. , as a feeling. In fact, there are nine sub-plots involved and each one explores a different facet of love: we have teenage love, we have illicit loves, we have unlikely romances, we have love triangles, we even have a love that blossoms without one or the other. speak the same language… and all during the pre-Christmas times! So I won't waste time sifting through each plot, maybe it's for the best.

The movie could have gone terribly wrong, but the truth is that it works reasonably well. It's not a film where we can like all the characters, obviously many of them are making mistakes in the name of love, but the truth is that the film brings, with all this, a much more human and realistic tone than others of its genre. : who has never made a mistake because they fell in love, or found themselves in love with the wrong person and with full awareness of it? Even so, and despite the merits, there are indeed some subplots that seem underwritten and poorly developed, and others that I just don't understand why they were added. And I'm not in favor of some of the jokes that were being made, there's some humor that doesn't work, even though the dialogue is good and well written.

I lost count of the number of great actors that went into this film. It seems that all the good British actors of the decade decided to book a coffee and show up. Some are more prominent, others not so much. Hugh Grant is one of the highlights of the film and he is really good in the role he has been given, and he plays very well with Martine McCutcheon, who also does well in her role. I also enjoyed the performances by Liam Neeson and his teenage stepson, Thomas Brodie-Sangster (who would later break out as an actor in Maze Runner). It is still beautiful to see the way their characters relate to each other and the intimacy that is created between them. Bill Nighy is funny and irreverent, but I didn't understand his subplot here, and Laura Linney is good at what she does, but I wasn't captivated by the character. The same can be said of Keira Knightley (I never particularly liked this actress). Emma Thompson is better, and she does a good job here. Finally, a small word of praise to Colin Firth, and also to my compatriot Lúcia Moniz. It feels good to see someone from our country shining abroad, and to hear our mother tongue in a foreign film.

The film is not brilliant on a technical level. Betting everything, or almost, on the script, on the performance of the actors and on the very competent direction by Richard Curtis, the film is not particularly remarkable in these points, assuming a standard aesthetic and having almost nothing at the visual level that surpasses the average. There are, however, some good aspects, related to the scenarios and the choice of filming locations, very well selected and used."
50314.0,My Architect: A Son's Journey,"World-famous architect Louis Kahn (Exeter Library, Salk Institute, Bangladeshi Capitol Building) had two illegitimate children with two different women outside of his marriage. Son Nathaniel always hoped that someday his father would come and live with him and his mother, but Kahn never left his wife. Instead, Kahn was found dead in a men's room in Penn Station when Nathaniel was only 11.",A man. His buildings. His secret lives.,Documentary,116.0,2003-11-12,en,7.0,30.0,0.3812,"Edmund Bacon, Edwina Pattison Daniels, Balkrishna Doshi, Frank Gehry, Philip Johnson","Nathaniel Kahn, Nathaniel Kahn","architect, modern architecture, life and career, testimony, biographical documentary",
10715.0,Looney Tunes: Back in Action,"Fed up with all the attention going to Bugs Bunny, Daffy Duck quits Hollywood, teams up with recently-fired stuntman Damien Drake Jr. and embarks on a round-the-world adventure, along with Bugs and The VP of Warner Bros. Their mission? Find Damien's father, and the missing blue diamond... and stay one step ahead of The Acme Corp., who wants the diamond for their own purposes.",How do they solve a mystery when they don't have a clue?,"Animation, Comedy, Family",91.0,2003-11-14,en,6.3,1539.0,2.5551,"Brendan Fraser, Jenna Elfman, Steve Martin, Joe Alaskey, Jeff Bennett",Joe Dante,"diamond, bunny, spy, movie business, duck, wretch, cartoon, villain, live action and animation","**Very friendly and well done, it's pure entertainment.**

Along with the world of Walt Disney's ducks, ""The Muppets"" and the various productions of Hanna and Barbera, the ""Looney Tunes"" and ""Merry Melodies"" are the largest and most popular sets of North American animation cartoons. And when it comes to the Tunes, we know what's going to happen: there's going to be a lot of crazy animation, explosions and funny effects.

This film will please Tunes fans, putting the most adorable and iconic characters on the big screen, and giving the spotlight, of course, to Bugs Bunny and Daffy Duck, the duo that is inseparable, even if they are always at odds. It all begins with the dismissal of Daffy and a human employee of the Warner studio, and will end in a kind of fight against evil, in support of the father of that employee who, in fact, is a secret agent in the image of James Bond. A seemingly crazy mix, but one that works thanks to the skill and irreverence of the Tunes.

I won't waste time talking about voice actors. The studio intelligently took advantage of those who usually voice these characters, so we are dealing with professionals who know very well what they do and what the characters ask of them. We have, however, an excellent comic performance by Brendan Fraser, who seems completely comfortable with what was asked of him and even seems to have fun with it all. Jenna Elfman isn't bad either, but she can't keep up with Fraser.

The movie is very good. It's pure entertainment, with classic touches that we're used to seeing in Tunes material. It's the case with that chase in the Louvre, or the various fights between Duffy and Bugs. Being a more humble and sympathetic film than Space Jam, I felt that it doesn't have the weight of excessive publicity against it, besides having a true comic actor in the main human role, and not an amateur trying to act it out."
8619.0,Master and Commander: The Far Side of the World,"After an abrupt and violent encounter with a French warship inflicts severe damage upon his ship, a captain of the British Royal Navy begins a chase over two oceans to capture or destroy the enemy, though he must weigh his commitment to duty and ferocious pursuit of glory against the safety of his devoted crew, including the ship's thoughtful surgeon, his best friend.",The courage to do the impossible lies in the hearts of men.,"Adventure, Drama, War",138.0,2003-11-14,en,7.2,3284.0,4.4115,"Russell Crowe, Paul Bettany, James D'Arcy, Robert Pugh, David Threlfall",Peter Weir,"epic, ship, navy, based on novel or book, surgeon, royal navy, historical fiction, period drama, napoleonic wars, naturalist, frigate, self surgery, sea battle, weevil, high seas, naval warfare, aggressive, 19th century, galapagos islands, naval battle, english navy, commanding, surprise-ending","For England, for home, and for the prize!  

Master and Commander: The Far Side of the World is directed by Peter Weir, it stars Russell Crowe as Jack Aubrey and Paul Bettany as Stephen Maturin. It is spliced from various novels in the Aubrey–Maturin series written by Patrick O'Brian. The film takes place during 1805, during the Napoleonic Wars and finds Captain Jack Aubrey and the crew of British frigate HMS Surprise ordered to intercept, destroy or take as a prize the French privateer Acheron. But the Acheron (The Phantom as the crew of the Surprise call her) is no ordinary ship, and her Captain is smart. So Lucky Jack has his work cut out; not only in the pursuit of the Acheron, but in harmonising the crew under his command. Especially his loyal and trusting friend Stephen.

It's pretty evident within the first few minutes of Master & Commander that this is no standard blockbusting naval based war movie. If you are after, or was expecting, a wave to wave Bruckheimer carnage a-like piece, well you best, or should have, stay(ed) away. For this is a Peter Weir movie, in fact this is a Peter Weir ""period"" movie, where attention to details and character dynamics are the order of the day. There's battle action here for sure, beginning and end, and terrific they are too, as first cannonballs crack and splinter their targets (note the sound work here), and later as blade meets blade - it's exhilarating stuff alright. However, this is more interested in palpable tension, both on deck and on the waves. Threat is never far away, again, this is is covered by the impending duel with the Acheron and Aubrey's tactical pursuit/escape of her. As the Aubrey machinations unfurl, the crew give us a series of character dramas to involve us in the make up of a man-o-war's personnel. How different classes and males (there's not one female in the film) of all ages have to work together as one efficient unit in order to survive and triumph. Except for an interlude spent on the lusciously filmed Galapagos Island (Russell Boyd Best Cinematography Academy Award Winner), the film is set 99% of the time out at sea, on a cramped ship, this tells you that Weir is interested in telling a character driven story, one that is cloaked in realism above all else.

The teaming of Weir with the highly rated O'Brian material looked a good one, and to someone like me who has never read an O'Brian novel, it is. Unsurprisingly many of O'Brian's fans have been upset by either the stuff missing in the film, the stuff put in to fully form Weir's vision of the characters, or for Crowe not being Pugwashy enough. These complaints were inevitable since they come with practically every adaptation of novels these days. It should be noted, though, that Weir was very much a fan of O'Brian, and in fact always felt inspired by the tight intricate detail of his writings. What of the author himself? Well he passed away three years before the film was released, but he had always envisaged Charlton Heston for the role of Aubrey. So, who in the modern era comes closest to Heston's physical presence on screen, why Russell Crowe of course. Who not only brings that to the character, but also depth, because Aubrey comes with many traits. Strength, honour, stubbornness, leadership and loyalty are a given for a Captain on the high seas. Yet Aubrey is also vulnerable, self aware, playful, knows his limitations and is able to laugh at himself. Crowe peels off each layer and delivers a high quality performance - from our first encounter with Crowe as Aubrey, the realism so loved by Weir is given a shot in the arm - and it stays throughout the movie.

So an excellent piece of casting then, as is that of Paul Bettany as ships surgeon, science and nature lover, and best pal of the Captain, Stephen Maturin. Bettany and Crowe had formed a friendship on 2001's A Beautiful Mind, where their on screen chemistry lifted an already fine film, to an even better one. So it be here also. Stephen & Jack's relationship is the core of the piece, two very different men yet as tight as two peas in a pod, with Stephen serving as the code breaker for the audience as sea talk and tactical intrigue weaves in and out of the story. It's there where Bettany excels, for he not only has us believing in this warm (platonic) friendship, he's also got us rooting for him since he is in essence the odd man out on this ship. Our sympathy is firmly with him, our friendly rebel if you please. Of the rest there's note worthy turns from Billy Boyd, James D'Arcy & Edward Woodall, while Lee Ingleby gives a really heartfelt and emotionally engaging turn as the haunted Hollom.

The film is not without flaws, though. The pace of the piece does slip from time to time, while the talky middle section may stretch the patience of some, and the film isn't long enough to give the main characters some back story for the audience to work off. Yet it's still a terrific movie, ripe with intelligence and interesting characterisations, and boasting enough adrenalin, humour and upset to fill out a big budgeted 1950s historical epic. So get on board folks, for this is quality film making and it demands to be seen via the best format available. 9/10 || This is a rousing sea yarn with great camera work, but it also shows comraderie and relationships in a realistic way on board a British fighting ship.

As happens sometimes but not always, I enjoyed this movie more than I liked the book it was based upon. O'Brian has written a lot of great sea tales, but this one confused me. I felt like checking to see if the pages were in the correct order. The story seems simplified in this adaptation. (Some may say that is not a good thing!)

The first several minutes of the film move the viewer around the ship, and I felt like It was a realistic representation of what it was like to sail on it. The creaking and other ever-present noises, the tight spaces allotted to the crew, all helped me feel like I knew what it was like more than just reading about it.

There are a lot of characters aboard ship, so out of necessity some of them never really developed, but even the glimpses we get of them here and there illustrate that they are people, not stereotypes. There were a few rather unlikely plot turns later on in the film, but by then I was drawn into the story and right there with the crew, so I forgave them.  I have watched Master and Commander twice so far, and wouldn't be averse to seeing it again. || I enjoyed <em>'Master and Commander: The Far Side of the World'</em>.

The early scenes are surprisingly (given the relatively close release dates) similar to fellow 2003 release <em>'Pirates of the Caribbean: The Curse of the Black Pearl'</em>, with a hidden enemy ship spotted amid foggy conditions and then one person spots unexpected cannon fire and tells others to duck... there are even main characters named Jack (lead!) and Will!

With those amusing (to me, given that POTC is my favourite film) connections noted, the film goes on, of course, to do it's own thing and I'd say it comes out very nicely. The constant (supremely shot) action is a major plus, as are the performances of Russell Crowe and Paul Bettany. I coulda done with more characterization for those behind Crowe and Bettany as I didn't overly care for them, though the support cast are all solid to be fair."
21525.0,Tupac: Resurrection,"Home movies, photographs, and recited poetry illustrate the life of Tupac Shakur, one of the most beloved, revolutionary, and volatile hip-hop MCs of all time.",In his own words,"Music, Documentary",112.0,2003-11-14,en,7.832,164.0,0.7226,"Tupac Shakur, Afeni Shakur, Snoop Dogg, Dr. Dre, 50 Cent",Lauren Lazin,"rap music, hip-hop, blunt, woman director",
14892.0,The Big Empty,"Struggling actor John Person agrees to drive a blue suitcase from Los Angeles to the small town of Baker, Calif., and hand it over to a mysterious cowboy in return for having his credit card debt of $27,000 paid off. Upon his arrival, John can't find the cowboy but receives an ominously head-shaped package he's supposed to hang onto. While waiting, John gets close to Ruthie, whose psychotic boyfriend, Randy, keeps threatening to kill him.",Cowboys. Aliens. Blue suitcases and bowling balls. Strange things are happening out in the middle of nowhere.,"Comedy, Drama, Mystery, Science Fiction",94.0,2003-05-16,en,6.112,76.0,0.6965,"Jon Favreau, Joey Lauren Adams, Rachael Leigh Cook, Daryl Hannah, Kelsey Grammer",Steve Anderson,"fbi, suitcase, alien, neighbor, conspiracy, desert, cowboy",
